{
  "id": "taxonomy",
  "name": "分类体系",
  "version": "1.0.0",
  "layer": "L2",
  "platform": ">=1.0.0 <2.0.0",
  "requires": {
    "content": "^1.0"
  },
  "optional": {},
  "disableable": false,
  "tablePrefix": "tx_",
  "apiPrefix": "taxonomy",
  "permissions": [
    {
      "code": "taxonomy:vocabulary:view",
      "name": "查看词汇表"
    },
    {
      "code": "taxonomy:vocabulary:manage",
      "name": "管理词汇表"
    },
    {
      "code": "taxonomy:term:view",
      "name": "查看分类项"
    },
    {
      "code": "taxonomy:term:edit",
      "name": "编辑分类项"
    },
    {
      "code": "taxonomy:term:delete",
      "name": "删除分类项"
    },
    {
      "code": "content:term-page:edit",
      "name": "编辑分类落地页"
    },
    {
      "code": "content:term-page:review",
      "name": "审核分类落地页"
    },
    {
      "code": "content:term-page:publish",
      "name": "发布分类落地页"
    },
    {
      "code": "content:term-page:delete",
      "name": "删除分类落地页"
    }
  ],
  "menus": [
    {
      "key": "taxonomy",
      "name": "分类体系",
      "parent": "editorial",
      "route": "/taxonomy/vocabularies",
      "permission": "taxonomy:vocabulary:view",
      "order": 100
    }
  ],
  "settings": null,
  "components": [],
  "events": {
    "publishes": [
      "TermChangedEvent",
      "TranslatableResourceChangedEvent"
    ],
    "subscribes": [
      "ContentPurgedEvent",
      "LocalizationDeletedEvent",
      "ModuleDisabledEvent",
      "SiteSettingsChangedEvent"
    ]
  }
}
