{
  "id": "media",
  "name": "媒体",
  "version": "1.0.0",
  "layer": "L2",
  "platform": ">=1.0.0 <2.0.0",
  "requires": {},
  "optional": {},
  "disableable": false,
  "tablePrefix": "mda_",
  "apiPrefix": "media",
  "permissions": [
    {
      "code": "media:asset:view",
      "name": "查看媒体"
    },
    {
      "code": "media:asset:upload",
      "name": "上传媒体"
    },
    {
      "code": "media:asset:edit",
      "name": "编辑媒体"
    },
    {
      "code": "media:asset:delete",
      "name": "删除媒体"
    },
    {
      "code": "media:folder:manage",
      "name": "管理文件夹"
    }
  ],
  "menus": [
    {
      "key": "media",
      "name": "媒体",
      "parent": "editorial",
      "route": "/media/assets",
      "permission": "media:asset:view",
      "order": 100
    }
  ],
  "settings": null,
  "components": [],
  "events": {
    "publishes": [
      "MediaUploadedEvent",
      "MediaUpdatedEvent",
      "MediaDeletedEvent",
      "TranslatableResourceChangedEvent"
    ],
    "subscribes": [
      "SiteSettingsChangedEvent",
      "ContentPurgedEvent"
    ]
  }
}
